Product,Minumim_price,Maximum_price,Shipping_cost
Global Version Samsung Galaxy S6 Edge SM-G925F - 32GB  Gold Platinum Smartphone,$136.00,ree s
Samsung Galaxy A05 4G 128GB SIM Free Android Mobile Phone Pristine,$145.55 to $164.53,25.43
Samsung Galaxy Xcover 5 SM-G525F/DS Dual SIM 64GB Unlocked Smartphone-New Sealed,$159.00,ree s
Unlocked Samsung Galaxy Express i8730 Original 3G 8GB ROM 1GB RAM WIFI Dual Core,$70.66,ree s
"Samsung Galaxy A03S 32GB (TracFone) 6.5"" Display 4GB RAM Black Smartphone - Good",$65.00,28.75
Samsung Galaxy A21 SM-A215U Black 32GB (GSM UNLOCKED) - Good,$105.00,29.93
Samsung Galaxy S5 SM-G900F 16+128GB Black (Without Simlock) with Android 13,$91.82,19.44
Samsung Galaxy J7 Crown Star Prime 32GB 2018 MetroPCS - T-Mobile or Unlocked 4b4,$79.99,28.42
New&Sealed Samsung Galaxy S6 edge SM-G925F(Global 32GB Black/White/Gold UNLOCKED,$129.99,ree s
Samsung Galaxy A50 64GB A505U Unlocked with LCD Shadows - Very Good,$83.99,29.31
1m USB to Type C Charger Charging Cable For Samsung S23 5g S22 S21 S10 S10+ S20,$7.58,12.66
NEW NO BOX Samsung SM-S711ULGEXAA Galaxy S23 FE 256GB,$469.98,39.93
Samsung Moment SPH-M900 - Black (Sprint) Smartphone,$60.00,32.91
T-Mobile Samsung Galaxy A21  - 32GB - (A215U),$79.99,37.89
Samsung Galaxy A13 5G SM-A136U 64GB Black (Unknown Carrier) Smartphone B 4602,$73.95,28.24
"MIXED Lot of 34  MOTOROLA, SAMSUNG, LG, VINTAGE FLIP Phones For Parts or repair",$124.00,102.1
GENUINE Samsung X600 Perfect Condition boxed Europe Vintage Slider,$81.02,54.01
New Samsung Galaxy S10 SM-G973F 128GB Multi-Colour Dual SIM Unlock Smartphone UK,$303.77,30.88
UNLOCKED Samsung T199 GSM QUADBAND 3G Large Buttons Black Cell Phone NEW,$44.99,27.39
Samsung Galaxy A13 5G SM-A136U1 - 64GB - Black (Unlocked) Metro ATT,$124.99,43.02
Samsung Galaxy S10e 128GB SM-G970U Unlocked Good Condition - Various Colors,$104.95,21.90
Samsung SGH-X660 Silver Cell Phone International - OPEN BOX,$44.99,66.80
Clear Phone Case For Samsung Galaxy Note 9 8 S8 9 S10 Plus Shockproof Heavy Duty,$9.45,26.34
Samsung Galaxy S23 Ultra 512GB Phantom Black Unlocked Excellent Condition,$949.99,54.09
"Samsung Galaxy S20 FE 5G SM-G781U1 Factory Unlocked 128GB 6.5"" Phone Very Good",$187.98,31.61
Samsung Galaxy S6 edge+ Plus - 32GB - Gold Platinum (Unlocked) Smartphone,$79.73,
CLEAR Case For Samsung Galaxy S10 Plus S9 S10e S8 S105G Silicone Gel Shockproof,$4.29 to $5.05,20.58
"SAMSUNG GALAXY A10E 5.83"" SM-A102U 32GB Black (Verizon) Smartphone - Pristine",$85.00,28.57
Samsung Galaxy S5 Neo SM-G903F 16 GB Unlocked Smartphone - Black,$99.00,38.97
For Samsung Galaxy S23 Ultra S22 S21 S20 FE Phone Case Shockproof Rugged Cover,$9.45,26.34
SAMSUNG Galaxy A14 4G LTE (128GB +4GB) Factory Unlocked (INT'L Version) BK,$148.97,30.46
Samsung Galaxy S22 Ultra SM-S908U Verizon Unlocked 256GB Phantom Black C,$519.99,41.40
Samsung Galaxy A10 (SM-A105M/DS) 32GB (GSM Unlocked) Dual SIM Smartphone - K1297,$68.99,28.10
"Samsung Galaxy S10e 128GB 256GB Unlocked G970 Very Good 5.8"" Smartphone SM-G970U",$134.89,30.81
Samsung Galaxy S21 5G - 128GB 256GB - All Colors - Excellent Condition,$249.00,33.41
Samsung Galaxy A50 SM-A505U Verizon Unlocked 64GB Black Very Good Medium Burn,$75.00,28.27
Samsung Galaxy A13 5G SM-A136U 64GB Black Unlocked AT&T T-Mobile TracFone - Good,$79.00 to $109.00,29.64
Samsung Galaxy SM-A045F/DS Black (International Unlocked) 32 GB. Open Box.,$149.00,31.23
Unlocked Original Samsung GT-E1150 2G GSM Mini-SIM Button Flip Mobile Phone,$28.03,ree s
Tracfone(Locked) Samsung Galaxy A10E- 32GB 5.8” -Black (NO SIM CARD) NEW !!!,$99.00,75.27
For Samsung Galaxy S22 S23 Ultra Shockproof Rugged Case Cover Tempered Glass,$11.39 to $14.24,26.40
Samsung Galaxy S8 SM-G950F 64GB Unlocked Android Smartphone Good Condition,$126.56,27.83
Samsung Galaxy Tab S5e 64GB Silver Verizon Unlocked - NEW & SEALED,$239.99,62.00
Samsung Galaxy S9 64GB - All colors - Unlocked - Used (LCD SHADOW),$99.99,29.01
Samsung Galaxy A40 SM-A405FN/D Dual SIM 64GB+4GB Unlocked Smartphone-New Sealed,$153.00,ree s
Samsung Galaxy A70 SM-A705W 128GB Black Unlocked Android Smartphone SEE PHOTO,$131.75,29.95
"Good! Samsung Galaxy S22 Ultra 6.8"" SM-S908U 128GB Black (Unlocked) Smartphone",$519.00,41.37
Samsung Galaxy S20 FE 5G SM-G781U - Cloud Navy (T-Mobile & Unlocked) 8.5/10 **,$164.85,23.67
6D Glass For Samsung Galaxy S23 S22 S21 S10+ S9 Tempered Glass Screen Protector,$6.32 to $10.11,12.66
Samsung Galaxy A12 SM-S127DL Cellphone (Black 32GB) Tracfone **READ**,$50.00,37.54
New ListingSamsung Galaxy A54 5G A546U 128GB - Awesome Graphite (T-Mobile) Smartphone - NEW,$269.95,68.68
For Samsung Galaxy A54 5G Magnetic Shockproof Protective Case Cover+Ring Stand,$11.39,26.40
Samsung Galaxy S21 5G - 128GB 256GB - All Colors - Excellent Condition,$249.00,33.41
Samsung Galaxy S21+ 5G G996U T-mobile Unlocked 128GB Black Very Good Heavy Burn,$189.99,31.67
Samsung Galaxy S9 G960U 64GB Fully Unlocked Verizon AT&T T-Mobile ALL COLORS,$144.99,30.34
NEW Samsung Galaxy S10 SM-G973F 128GB Cardinal Red Unlocked Smartphone UK,$303.77,30.88
Samsung Galaxy A71 5G SM-A716U 128GB+6GB 64MP Unlocked Smartphone- New Unopened,$212.00,ree s
Unlocked Samsung Galaxy A52 5G - 128GB - USA Model Black World Smart Phone Good,$153.99,31.38
Samsung Galaxy SCH-R830C Silver Smartphone,$29.99,35.95
FOR T-MOBILE Samsung Galaxy A32 5G - 64GB - Awesome Black - Good,$89.99,29.49
"SAMSUNG GALAXY NOTE EDGE, 32GB (AT&T) CLEAN ESN, WORKS, PLEASE READ!! 56955",$55.65,164.0
Samsung Galaxy A71 5G 128GB Black SM-A716U AT&T T-Mobile (GSM Unlocked) - Good,$135.00,30.04
Samsung Galaxy A21s Dual Sim 32GB/ 64GB/ 128GB Unlocked Smartphone- New Unopened,$156.00 to $219.00,ree s
"Samsung Galaxy A12 SM-A125U 32GB+3GB 48MP 6.5"" Unlocked Smartphone- New Unopened",$118.00,ree s
Samsung Galaxy S21 5G 128GB G991U Unlocked with LCD Shadows - Used,$160.99 to $179.99,31.37
Samsung Galaxy A14 4G 128GB Unlocked Phone - Black,$198.80,16.30
Samsung Galaxy A54 5G 128GB 8GB RAM SM-A546E/DS FACTORY UNLOCKED,$338.80,36.83
Samsung Galaxy A10e SM-A102U - 32GB - Black (Verizon) B-stock,$59.98,27.83
"Samsung Galaxy S10e 128GB 256GB Unlocked G970 Very Good 5.8"" Smartphone SM-G970U",$134.89,30.81
Samsung Galaxy Core Prime SM-G360P - 8GB - White Smartphone,$19.99,33.42
Samsung Galaxy A02s SM-A025G/DSN 32GB Black Unlocked Dual SIM Good Condition 401,$62.71,37.96
Working Samsung SGH Z107 Silver (Unlocked) Mobile Phone flip phone classic z105,$50.62,12.64
Samsung A21s 32gb Used But In Good condition Will Include Accessories See Below.,$63.29,
For Samsung Galaxy S22 Ultra Military Grade Shockproof Armor Rugged Case Cover,$11.39,26.40
Samsung Galaxy S22 Ultra SM-S908U Verizon Unlocked 256GB Phantom Black C,$519.99,41.40
Verizon Samsung Galaxy Z Flip3 128GB Black Very Good - Minor Screen Flaw,$179.00,31.34
Samsung Galaxy A42 5G SM-A426U SM-A426B/DS 128GB Unlocked Smartphone-New Sealed,$179.00 to $199.00,ree s
For Samsung A13 A52 A53 A22 A12 Clear JELLY Case Shockproof Ultra slim Gel Cover,$3.78 to $5.05,20.58
SAMSUNG GT E1190 GSM UNLOCKED SIM FREE UNLOCK NO SGH CELL PHONE E2210B E1150,$26.99,16.19
Samsung Galaxy A14 5G (Latest) SM-A146U AT&T 64GB Smartphone - Black,$145.99,31.14
Unlocked / T-Mobile TELLO Lyca Samsung Galaxy A20 4G LTE Smart Phone *A GRADE,$49.90,35.26
Samsung Galaxy Z Fold 4 SM-F936U1 Factory Unlocked 256GB Phantom Black Good,$599.99,44.53
Samsung Galaxy A31 SM-A315F/DS Dual SIM Android 6GB RAM 128GB ROM Phone,$235.59,ree s
Samsung Galaxy Note 20 Ultra 5G N986U 128GB Unlocked | Dead Pixel,$334.99,35.94
SEALED (Retail: $149.99) Samsung Galaxy Buds Live Wireless Bluetooth Earbuds NEW,$84.99,21.31
"Samsung Galaxy A12 SM-A125U 32GB+3GB 48MP 6.5"" Unlocked Smartphone- New Unopened",$118.00,ree s
Samsung Galaxy S9 G960U 64gb Factory Unlocked / Verizon T-Mobile AT&T,$249.88,33.43
Anti Shock  Transparent Crystal Clear Gel Case For Samsung S22 S21 S10 A12 S9 S8,$3.78 to $5.05,20.58
Samsung Galaxy S10e SM-G970U 128GB+6GB Factory Unlocked Smartphone - New Sealed,$217.00,ree s
Samsung Galaxy A40 SM-A405FN/D Dual SIM 64GB+4GB Unlocked Smartphone-New Sealed,$153.00,ree s
Samsung Galaxy Note 9/8/S10/S10E/S9/S8 Plus USB Type-C Cable Fast Charger,$14.91,26.50
Flip Leather Book Case for Samsung Galaxy A53 A13 S22 S23 Magnetic Wallet Cover,$8.85,12.66
Samsung GT B2710 - Black (Unlocked) Mobile Phone,$183.53,26.73
Samsung Galaxy S22 5G 128-256GB Fully Unlocked - Used All colors,$289.99,35.39
Samsung Galaxy S8+ G955F G955U 64GB Single Sim Unlocked Android Smartphone,$243.00 to $268.00,ree s
Samsung Galaxy A42 5G SM-A426U SM-A426B/DS 128GB Unlocked Smartphone-New Sealed,$179.00 to $199.00,ree s
"Samsung Galaxy A12 SM-A125U 32GB+3GB 48MP 6.5"" Unlocked Smartphone- New Unopened",$118.00,ree s
Samsung Galaxy S9 G960U 64gb Factory Unlocked / Verizon T-Mobile AT&T,$249.88,33.43
Samsung Galaxy S22 5G 128-256GB Fully Unlocked - Used All colors,$289.99,35.39
Samsung Galaxy S20 Ultra 5G G988U Verizon Unlocked 128GB Black Good Medium Burn,$209.99,32.26
CLEAR Case For Samsung Galaxy S10 Plus S10e S9 S8 5G Silicone Gel Shockproof,$4.67 to $4.92,20.57
Samsung Galaxy S20 FE 5G 128GB All Colors (Verizon) Smartphone - Good Condition,$144.95,30.34
SAMSUNG GALAXY A13 5G A136U 64GB Smart Phone / UNLOCKED AT&T T-Mobile *B GRADE*,$69.90 to $89.90,38.37
"Samsung Xcover 550 B550H B550 Phone 3.15MP Camera FM radio Bluetooth 2.4""",$57.34,ree s
Samsung Galaxy S8+ G955F G955U 64GB Single Sim Unlocked Android Smartphone,$243.00 to $268.00,ree s
Samsung Galaxy S10+ SM-G975U Factory Unlocked 128GB Prism White C Light Burn,$145.00,30.34
"New ListingDuraSport Kyocera E6910,64GB, Black, Verizon Lock, Fair Condition:EE349",$49.00,28.28
Samsung Galaxy S9 G960U 64GB Fully Unlocked Verizon AT&T T-Mobile ALL COLORS,$144.99,30.34
GSM Unlocked Samsung Galaxy A11 Black 32GB 6.4'' Smartphone 2GB RAM - Pristine,$95.00,28.86
Unlocked Samsung Galaxy Note 20 5G 🔥 128GB Gray Bronze Green,$399.00,37.83
Samsung Xcover GT-B2710 16GB Black (without Simlock) 100% Original!! Like new!!,$181.39,48.61
Samsung Galaxy S20+ 5G G986U Verizon Unlocked 128GB Black Good Extreme Burn,$139.99,30.19
Samsung Galaxy S21 FE 5G SM-G990U Xfinity Unlocked 128GB Graphite Good,$199.99,32.73
New ListingSamsung Galaxy S21 5G SM-G991U 256GB Unlocked AT&T T-Mobile Verizon GSM 7570111,$229.00,32.82
Samsung Galaxy S7 Edge SM-G935F - 32GB - Gold (Unlocked) (Single SIM),$181.00,ree s
Samsung Illusion SCH-I110 - 2GB - Black (Verizon) Smartphone,$24.99,26.80
Samsung SGH-E900 World Wide Olympic Partner (International) Flip Phone GSM 3G,$44.99,33.51
Samsung Galaxy A14 5G SM-A146U Black Variety Carriers,$129.99 to $149.99,30.49
Samsung Galaxy Express i8730 Original 3G WIFI 8GB ROM 1GB RAM Dual Core Unlocked,$65.81,ree s
Samsung Galaxy Note 10 Plus Case With Tempered Glass Full Body Protection Rugged,$18.99,26.62
Samsung Galaxy A51 A515U Factory Unlocked 128GB Black C Medium Burn,$89.99,29.49
For Samsung Galaxy S21 S22 S23 Ultra Plus Plating Shockproof Hybrid Case Cover,$10.44 to $11.39,26.40
Samsung Galaxy A10e SM-A102U - 32GB - Black (Verizon) (Single SIM),$45.00,33.32
Samsung Galaxy J5 Smart Phone 16GB Unlocked Single Sim Black Android Grade B,$67.07,22.72
UNLOCKED or T-Mobile Samsung Galaxy J3 SM-J327 4G LTE Smart Cell Phone *B GRADE*,$29.90 to $42.80,26.64
Samsung Galaxy A50 -64GB- Xfinity Locked - Pre-Owned Very Good Condition,$69.99,28.13
Samsung Galaxy A31 SM-A315F/DS Android Dual SIM SIM 6GB RAM 128GB ROM Phone,$233.11,ree s
Tracfone Samsung Galaxy A02S S124DL,$72.09,28.19
Samsung Galaxy Note9 128/512GB Fully Unlocked - All colors - Refurbished Grade A,$229.99,33.62
Samsung Galaxy J6+ Plus (SM-J610FN) 32/64GB Unlocked All Colours Open Never Used,$101.25,27.83
"Case For Samsung Galaxy S22, S22 Plus Shockproof Hybrid Rugged Cover",$4.37 to $6.90,20.64
USED Samsung Galaxy A50 SM-A505U 64GB Black Verizon,$89.99,21.46
Samsung SGH-S200 Worldwide Olympic Partner (International) Cell Phone - Silver,$112.49,66.80
Samsung Galaxy Note 10+ SM-N975U Verizon Unlocked 256GB Aura Blue Good,$245.00,33.29
"SAMSUNG M23 M236B 5G 6.6"" 4GB 128GB DualSIM Light Blue- Genuine",$311.22,16.50
✅Samsung Galaxy J7 SM-J700 Dual SIM (Unlocked) 16GB Android Smartphone 9/10 A,$49.99,20.28
Samsung Galaxy S22 SM-S901U - 128GB - Phantom Black (Verizon),$359.98,37.45
Samsung Galaxy S22 SM-S901U Factory Unlocked 128GB Pink Gold Very Good,$339.99,36.09
Samsung Galaxy S22 5G SM-S901U 256GB Carrier Unlocked - Any Carrier,$374.95,83.41
Samsung Galaxy A22 5G Broken Screen For Parts Spain,$102.62,12.96
Samsung Galaxy A10e SM-A102U - 32GB - Charcoal Black (AT&T) (Single SIM),$79.35,28.40
Samsung Galaxy A10e SM-A102U - 32GB - Black (Verizon) (Single SIM),$45.00,33.32
Samsung Galaxy J5 Smart Phone 16GB Unlocked Single Sim Black Android Grade B,$67.07,22.72
USED Samsung Galaxy A50 SM-A505U 64GB Black Verizon,$89.99,21.46
Samsung SGH-S200 Worldwide Olympic Partner (International) Cell Phone - Silver,$112.49,66.80
For Samsung Galaxy S21 S22 S23 Ultra Plus Plating Shockproof Hybrid Case Cover,$10.44 to $11.39,26.40
UNLOCKED or T-Mobile Samsung Galaxy J3 SM-J327 4G LTE Smart Cell Phone *B GRADE*,$29.90 to $42.80,26.64
Samsung Galaxy A51 128GB 6.5'' SM-A515U Black Unlocked T-Mobile Verizon - Good,$109.00 to $199.00,30.64
Samsung Galaxy A50 -64GB- Xfinity Locked - Pre-Owned Very Good Condition,$69.99,28.13
Samsung Galaxy A31 SM-A315F/DS Android Dual SIM SIM 6GB RAM 128GB ROM Phone,$233.11,ree s
Samsung Galaxy A22 5G Broken Screen For Parts Spain,$102.62,12.96
Tracfone Samsung Galaxy A02S S124DL,$72.09,28.19
Samsung Galaxy Note9 128/512GB Fully Unlocked - All colors - Refurbished Grade A,$229.99,33.62
Samsung Galaxy J6+ Plus (SM-J610FN) 32/64GB Unlocked All Colours Open Never Used,$101.25,27.83
Samsung Galaxy A10e SM-A102U - 32GB - Charcoal Black (AT&T) (Single SIM),$79.35,28.40
Samsung Galaxy A42 5G SM-A426U 128GB Black (Unlocked) W/Retail Box - Very Good,$165.00,31.70
"Boost Mobile Samsung A13 LTE 32GB, Black - Prepaid Smartphone New No Box",$75.00,38.85
"Case For Samsung Galaxy S22, S22 Plus Shockproof Hybrid Rugged Cover",$4.37 to $6.90,20.64
Samsung Galaxy Note 10+ SM-N975U Verizon Unlocked 256GB Aura Blue Good,$245.00,33.29
"SAMSUNG M23 M236B 5G 6.6"" 4GB 128GB DualSIM Light Blue- Genuine",$311.22,16.50
✅Samsung Galaxy J7 SM-J700 Dual SIM (Unlocked) 16GB Android Smartphone 9/10 A,$49.99,20.28
Factory Unlocked Samsung Galaxy A42 128GB Black EXCELLENT W/ retail Box,$145.00,31.11
Samsung Galaxy S22 SM-S901U - 128GB - Phantom Black (Verizon),$359.98,37.45
ORIGINAL SIMPLE CHEAP PENSIONER BUTTONS FLIP  SAMSUNG Z140V  UNLOCKED,$27.85,17.72
Samsung Galaxy S22 SM-S901U Factory Unlocked 128GB Pink Gold Very Good,$339.99,36.09
Samsung Galaxy S22 5G SM-S901U 256GB Carrier Unlocked - Any Carrier,$374.95,83.41
New ListingSamsung Galaxy A03s SM-A037U - 32GB - Black (Verizon) DEFECTIVE,$29.95,27.72
Samsung Galaxy Z Flip 4 SM-F721U Verizon Unlocked 256GB Graphite Very Good,$309.99,35.98
For Samsung Galaxy S22 Ultra Case Ring Holder Slim Rugged Protective Cover Black,$22.99,26.74
Samsung Galaxy Tab2 10.1 Tablet Great Condition Working With Box + Cables,$102.62,21.50
NEW 3G 16GB SAMSUNG GALAXY S4 GT-I9500 ANDROID SINGLE SIM UNLOCKED SMARTPHONE UK,$82.26,23.24
For Samsung Galaxy S22 ULTRA Note20 S21 Screen Protector Tempered Glass Cover,$7.58 to $10.11,12.66
Samsung Galaxy A5 (2017) A520F A520F/DS Single/Dual SIM 32GB ROM Android Phone,$84.55 to $89.25,ree s
Samsung Galaxy A03s SM-A037U - 32GB - Black (T-Mobile) LOCKED Brand New,$84.99,29.34
"New ListingRevvly XT1952-T, 32GB ,Black, T.Mobile Lk, Fair Condition:EE298",$29.00,27.69
NEW Samsung Galaxy S23 5G SM-S911U 128GB/256GB FACTORY UNLOCKED ❖SEALED❖,$586.06,
New ListingSamsung Convoy 3 Flip Phone CDMA SCH-U680 (VERIZON) - TESTED,$9.99,26.36
Samsung Galaxy A13 SM-A136U - 64GB - Black (T-Mobile 5G + GSM Unlock) - Good,$94.99,28.86
A Series - Samsung Galaxy A03s SM-A037U 32GB Black 6.5'' (For AT&T) - Good,$69.00,28.10
UNUSED Factory Unlocked Samsung Galaxy A51 128GB Black  - NO RETAIL BOX,$179.00,31.34
Samsung Galaxy Folder G1600 Dual SIM 16GB LTE Flip SmartPhone- New Sealed,$108.00,ree s
Flip Leather Phone Case for Samsung S22 Ultra A53 / A52  Magnetic Wallet Cover,$8.85 to $10.11,12.66
Samsung Galaxy Z Flip4 128GB 256GB 512GB ALL COLOR (Unlocked) BOX PACK UK SPEC.*,$505.03 to $537.94,38.96
"Samsung Galaxy A14 A145F 64GB 4GB 6.6"" Factory Unlocked International New",$152.36,31.33
LOT OF 10 Samsung Galaxy S5 active G870a/G870w mix colors read please,$159.95,30.78
For Samsung Galaxy S10 S10+ S8 S9 SS7 Edge Case Cover Leather Wallet Book Phone,$8.85,12.66
New Other Samsung Galaxy A13 5G SM-136U 64GB AT&T Black Android Smartphone,$89.99,28.72
Samsung Galaxy A20e A202F/DS Dual SIM 32GB+3GB Unlocked Smartphone- New Unopened,$131.00,ree s
Samsung Galaxy S20 | S20+ | S20 FE | S20 Ultra 5G 128GB (Unlocked) - Good,$189.95 to $264.95,24.85
Samsung Galaxy Z Flip3 5G SM-F711U - 128GB - Phantom Black (Verizon) DEFECTIVE,$79.99,28.42
Samsung Galaxy Trend Duos GT-S7562 (Unlocked) Smartphone 3G GSM - International,$67.49,67.71
6D Glass For Samsung Galaxy S23 S22 S21 S10+ S9 Tempered Glass Screen Protector,$6.32 to $10.11,12.66
Samsung Galaxy A03 GREAT CONDITION!! SM-A037U - 32GB - Blue (AT&T),$49.00,33.68
Fair Samsung Galaxy S7 32GB Sapphire Black Verizon Android Smartphone SM-G930V,$44.99,27.39
Samsung Galaxy A54 SM-A546U - 128GB - Awesome Graphite,$300.00,44.38
CLEAR Case For Samsung Galaxy S10 Plus S10e S9 S8 5G Silicone Gel Shockproof,$4.67 to $4.92,20.57
Brand New Samsung Galaxy A03S 32GB 4G LTE Unlocked GSM Worldwide Smartphone,$108.00,29.25
Samsung Z500 phone for sale,$55.00,20.00
Grade B+ Good! Fully Unlocked 6.2 Inches Samsung Galaxy S20 5G 128GB Gray,$175.00,31.22
Android Samsung Galaxy A42 5G SM-A426B/DS Original Dual SIM 4GB/128GB Phone,$159.81,ree s
Samsung Galaxy J7 Prime SM-J727T T-Mobile Unlocked 16GB Gold Good,$49.99,27.54
New Samsung Galaxy S10e SM-G970F 128GB Red 4G LTE DUAL SIM Unlocked Smartphone,$265.79,29.57
New ListingSamsung Galaxy A54 5G A546U 128GB - Awesome Graphite (T-Mobile) Smartphone - NEW,$269.95,68.68
Samsung Galaxy A11 Black 32GB 6.4'' (T-Mobile) Smartphone 2GB RAM - Pristine,$89.00,28.69
Samsung Galaxy A03s SM-A037U1/DS - 32GB - Black (Unlocked),$80.00,37.79
"SAMSUNG M23 M236B 5G 6.6"" 4GB 128GB DualSIM Light Blue- Genuine",$311.22,16.50
Samsung Galaxy J7 Crown Star Prime 32GB 2018 MetroPCS - T-Mobile or Unlocked 4b4,$79.99,28.42
Samsung Galaxy S8 SM-G950U GSM Global Unlocked 64GB Smartphone - Good,$104.99,29.16
Brand New Samsung Galaxy J7 Duos SM-J700F Dual SIM 16GB Unlocked Smartphone,$69.00,ree s
Samsung A13 5G 64Gb / 3Gb Ram / 50Mp / 5000 mAh Android GRADEs,$139.23 to $170.88,63.29
UNLOCKED Samsung T199 GSM QUADBAND 3G Large Buttons Black Cell Phone NEW,$44.99,27.39
"Excellent! Fully Unlocked 6.4""Samsung Galaxy A20 SM-A205U 32 GB Black Smartphone",$109.00,29.28
Original Samsung Galaxy Mega 6.3 I9200 8GB ROM 1.5GB RAM AT&T Android SmartPhone,$54.14,18.00
Brand New Samsung Galaxy A54 5g US Version Fully Unlocked Smartphones,$599.99,43.76
"Samsung Galaxy A14 A145F 64GB 4GB 6.6"" Factory Unlocked International New",$152.36,31.33
Samsung Galaxy A03S 32GB Black A037U A Series Unlocked / AT&T / Verizon - Good,$69.00 to $99.00,28.10
Samsung Galaxy S20 Ultra 5G G988U Verizon Unlocked 128GB Black Good Medium Burn,$209.99,32.26
Samsung Galaxy S10 Lite (SM-G770F/DS) 128GB (GSM Unlocked) Dual SIM - BLEMISHED,$143.99,30.31
DEFECTIVE - Samsung Galaxy S20+ 5G - 128GB - Blue - GSM Unlocked -SM-G986U- 3912,$142.49,30.27
Samsung Galaxy S10+ SM-G975U Verizon Unlocked 128GB Prism Black Good Medium Burn,$134.99,30.04
Samsung Galaxy Xcover FieldPro SM-G889A  64GB Rugged Black AT&T Locked Very Good,$189.99,31.67
Samsung Galaxy S8+ G955U T-Mobile Unlocked 64GB Gray Excellent Heavy Burn,$69.99,28.13
For AT&T - Samsung Galaxy S21 5G 6.2'' SM-G991U 128GB Phantom White - Open Box,$269.00,34.00
New Other Samsung Galaxy A14 5G SM-A146U 64GB Black Verizon Smartphone Android,$99.99,29.01
Samsung Galaxy J6 2018 32GB 64GB Unlocked All Colours A+ Excellent Condition,$75.93,23.02
For Samsung Galaxy Note20 Ultra MagSafe Magnetic Case Slim Cover,$11.39,26.40
Samsung Galaxy A31 SM-A315F/DS Android Dual SIM SIM 6GB RAM 128GB ROM Phone,$233.11,ree s
Samsung Galaxy A14 64GB Black (T-Mobile) Smartphone - Grade B+ Good Condition,$89.00,28.69
Used Great Samsung Galaxy Note 10+ AT&T Unlocked SM- N975U 256GB 1Y warranty,$289.99,34.62
Samsung Galaxy Express i8730 Original 3G WIFI 8GB ROM 1GB RAM Dual Core Unlocked,$65.81,ree s
9d Screen Protector For Samsung Galaxy S23 S22 S21 S20 FE S10 + Tempered Glass,$5.05 to $8.85,12.66
Samsung Galaxy A50 SM-A505U Verizon Unlocked 64GB Black Good Medium Burn,$69.99,28.13
New Other Samsung Galaxy S10 SM-G973 Xfinity / Boost Mobile  Smartphone,$159.95 to $169.95,30.78
"For Samsung Galaxy Z Fold 4 Case,Shockproof Heavy Duty Rugged Z Fold4 Slim Cover",$15.19,26.51
Samsung Galaxy S9 SM-G960U1 Unlocked 64GB Midnight Black Good,$109.99,29.31
Samsung Galaxy Z Flip3 5G SM-F711U - 128GB - Phantom Black (Unlocked),$300.00,45.62
Samsung Galaxy S5 Active | SM-G870A | 16GB | Camo | AT&T Unlocked | READ,$42.40,27.31
DEFECTIVE - Samsung Galaxy S20+ 5G - 128GB - Blue - GSM Unlocked -SM-G986U- 3912,$142.49,30.27
NEW 4G LTE 32GB SAMSUNG GALAXY A10e ANDROID FAST UNLOCKED SMARTPHONE UK,$139.22,25.20
Samsung Galaxy A14 64GB Black (T-Mobile) Smartphone - Grade B+ Good Condition,$89.00,28.69
Used Great Samsung Galaxy Note 10+ AT&T Unlocked SM- N975U 256GB 1Y warranty,$289.99,34.62
Case for Samsung Galaxy A50 A40 Luxury Slim Shockproof Hybrid HEAVY Armor Cover,$5.05,20.58
Samsung SGH-E900 World Wide Olympic Partner (International) Flip Phone GSM 3G,$44.99,33.51
NEW Samsung Galaxy S22 5G SM-S901U1 256GB FACTORY UNLOCKED ❖SEALED❖,$524.00,41.52
🌟🌟Brand New Samsung Galaxy S10 SM-G973U1 FACTORY UNLOCKED SMARTPHONES 🌟🌟,$257.99,33.67
Brand New Samsung Galaxy J7 Duos SM-J700F Dual SIM 16GB Unlocked Smartphone,$69.00,ree s
Samsung Galaxy Z Flip3 5G SM-F711U - 128GB - Phantom Black (Unlocked),$300.00,45.62
For Samsung Galaxy S23 Ultra Shockproof Rugged Heavy Duty Case Stand Cover,$11.39,26.40
New ListingSamsung Galaxy Z Flip4 128GB Unlocked AT&T T-Mobile Verizon 100% batt! 7573549,$308.00,35.92
Samsung Galaxy J56 Smart Phone 16GB Unlocked Dual Sim Black Android Grade B,$63.27,22.58
Samsung Galaxy S10e G970V 128GB Unlocked Smartphone Prism Black Good,$117.00,29.51
Samsung Galaxy A03s SM-A037U 32GB AT&T Only Blue Smartphone -EXCEPTIONAL,$68.00,28.07
Factory Unlocked Samsung Galaxy S22 Ultra 512GB AT&T T-Mobile Verizon Excellent,$655.00,46.16
New ListingSamsung Galaxy A32 5G 64GB (Unlocked) SM-A326U1 Awesome Black - Good Condition,$94.95,28.86
Samsung Galaxy A50 SM-A505U Factory Unlocked 64GB Black Good Heavy Burn,$69.99,28.13
Samsung Galaxy S10+ SM-G975U Verizon Unlocked 128GB Prism Blue Good Heavy Burn,$129.99,29.90
Samsung Galaxy J4 16GB Smart Phone Single Sim Unlocked Gold Grade A,$63.27,22.58
New&Sealed Samsung Galaxy S6 edge SM-G925F(Global 32GB Black/White/Gold UNLOCKED,$129.99,ree s
SAMSUNG GT E1150 GSM UNLOCKED SIM FREE UNLOCK CELL PHONE NO E1190 SGH E2210B,$16.19,16.19
Samsung Galaxy A51 128GB 6.5 inch Display A515U Black (Unlocked) - Good,$129.00,29.87
Samsung Galaxy S10 128GB SM-G973 T-Mobile GSM Unlocked AT&T Open Box New Other,$189.84,31.66
Fully Unlocked Samsung Galaxy A23 A236U 5G 64GB Black Smartphone Good,$146.99,31.17
Shockproof Case Cover For Samsung Galaxy A13 A34 A53 A54 Note 10+ S20 S21 FE 5G,$8.98 to $11.39,26.40
Samsung Galaxy Note 10+ 5G N976V Verizon Unlocked 256GB White Good Heavy Burn,$219.99,32.55
Shockproof Rugged Hybrid Hard Stand Armor Case For Samsung S20 S21 S22 Ultra,$6.19,20.62
Samsung Galaxy Z Fold4 5G F936U1 512GB (Unlocked) Verizon T-Mobile AT&T 4379,$489.00,40.49
Unlocked Samsung Galaxy A42 5G SM-A426U 6GB 128GB Gray Black B GRADE W/ Shadow,$89.00 to $129.00,28.69
for Samsung Galaxy S22 Ultra Case  Military Grade Protection Cover Armor Rugged,$19.99,27.42
Samsung Galaxy A6 A600P - 32GB - Black - (Sprint) - C Stock Light Burn,$36.99,27.15
Samsung Galaxy Z Flip5 256GB SM-F731U Unlocked Lavender (Excellent),$597.99,43.70
For Samsung Galaxy S21 Ultra S21 / S20 FE Case Cover Leather Wallet Book Phone,$8.85,12.66
Samsung Galaxy Note 10+ N975U Verizon Unlocked 256GB Black Good Light Burn,$225.00,32.70
360° TPU Case Shockproof Full Protector Cover For Samsung Galaxy S21 S20 FE A52,$7.58,12.66
Samsung Galaxy Note 10+ Plus 256GB 5G SM-N976V Verizon GSM UNLOCKED- Screen SBI,$259.95,33.73
For Motorola Moto G Stylus 5G 2021/2022/2023 Case Cover Belt Clip Fit Otterbox,$7.59 to $13.86,26.29
Samsung Galaxy S5 SM-G900T 16GB T-Mobile CDMA Unlocked Smartphone Blue Grade A+,$48.55,27.49
Samsung Galaxy A13 5G SM-A136U1 - 64GB - Black (Unlocked) Metro ATT,$124.99,43.02
Case for Samsung Galaxy S24 S24+ S23 S22 S21 S20 Shockproof Gorilla Clear COVER,$5.05 to $7.58,12.66
Samsung Galaxy A42 5G SM-A426U 128GB Prism Dot Black (Unlocked) - Good,$115.00,30.23
Samsung Galaxy S9 SM-G960U Factory Unlocked 64GB Midnight Black Very Good,$129.99,30.67
"Samsung Galaxy A11 / M11 32GB 6.4"" Unlocked Android Phone Pristine Condition",$125.31,24.73
"Original Samsung S7562 Galaxy S Duos Unlocked 4"" 3G dual sim android",$37.99,18.00
Samsung Galaxy Z Flip 3 5G F711U Factory Unlocked 256GB Black C Heavy Scratch,$179.99,31.37
"SAMSUNG GALAXY A10E 5.83"" SM-A102U 32GB Black (Verizon) Smartphone - Pristine",$85.00,28.57
"Samsung Z Flip4 5G SM-F721U 256GB, Purple (AT&T) Cricket 99A 4367",$259.00,33.70
Samsung Galaxy SM-J737V - 16GB - Black AT&T - Used - nice shape - No Sim,$59.99,50.88
Samsung Galaxy A54 Enterprise Edition SM-A546B/DS - 128GB - Graphite (Unlocked),$784.75,54.05
Samsung Galaxy Note 20 SM-N980F Dual Sim - 256gb Grey Unlocked Light Screen Burn,$220.50,33.34
Samsung Galaxy A03 GREAT CONDITION!! SM-A037U - 32GB - Blue (AT&T),$49.00,33.68
"Samsung Galaxy A12 SM-A125U 32GB+3GB 48MP 6.5"" Unlocked Smartphone- New Unopened",$118.00,ree s
Samsung Galaxy Z Fold 3 5G SM-F926U1 Factory Unlocked 256GB Phantom Black Good,$429.99,39.52
