Product,Minumim_price,Maximum_price,Shipping_cost
For Samsung Galaxy S24/S23/S22/S21 Ultra Shockproof Protective Rugged Case Cover,$7.59 to $11.39,26.29
Samsung Galaxy S21+ 5G SM-G996U1 Factory Unlocked 128GB Phantom Black C,$209.99,32.26
Verizon Samsung Gusto 3 SMB311VZPP Flip Phone New Unopened Box,$199.97,32.73
New ListingLot of 4 Assorted Smartphone Ipod Apple Samsung sm tablet motorola kyocera parts,$19.95,61.30
Samsung Galaxy S10+ G975U 128GB Unlocked,$179.99,31.37
Samsung Galaxy A13 LTE SM-A135U1/DS - 32GB - Black (Unlocked),$89.99,29.49
Samsung Galaxy K zoom SM-C111 - 8GB - Shimmery White (Unlocked) Smartphone,$198.79,32.70
Samsung Galaxy Z Flip5 SM-F731B - 256GB - 512GB (Unlocked) ALL COLOURS Excellent,$696.15,44.42
Samsung Galaxy S7 G930V 32GB Gold (Verizon) - Acceptable,$62.99,27.92
Unlocked 3.0'' SAMSUNG GALAXY YOUNG S6310 Original 3G Wifi 3MP 4GB Android Smart,$60.15,ree s
"Unlocked Samsung Galaxy S20 Fe 5g, 128gb Double Sim Card",$200.00,73.06
Brand New Samsung Galaxy S23 Ultra 256GB 12GB 5G LTE UNLOCKED DUAL SIM 2023,"$1,112.59",58.79
Samsung Galaxy A50 SM-A505U 64GB+4GB RAM 25MP LTE Unlocked Smartphone-New Sealed,$134.00,30.01
Samsung Galaxy S9 | S9+ 64GB 128GB 256GB Unlocked Verizon T-Mobile AT&T - Good!,$104.95 to $169.95,22.93
Samsung Galaxy Note 10+ 5G SM-N976V Verizon Unlocked 512GB Aura Black Very Good,$279.99,35.09
Clear Case For Samsung S20 S10 Plus A51 A21s S8 S9 A71 A10 Silicone Phone Cover,$5.05,20.58
Samsung Galaxy J7 (2017) SM-J737 V - 16GB - Black (Verizon),$9.00,36.93
Samsung Galaxy S22 5G S901U (Verizon) Locked - Excellent,$319.99,35.50
Samsung Galaxy A04 Dual Sim 32GB Unlocked Andriod Smartphone 4G LTE All Colours,$104.99,24.02
SAMSUNG GALAXY S21 ULTRA 5G G998U1 128GB PHANTM SILVER (FACTORY UNLOCKED) SEALED,$407.95,38.87
Samsung Galaxy S22 SM-S901U - 128GB - Phantom Black (Factory Unlocked),$386.98,38.25
Samsung Galaxy Note 10+ 5G N976UW 256GB Unlocked with LCD Shadows - Very Good,$219.99,32.55
Samsung Galaxy S5 Active | SM-G870A | 16GB |Gray |  AT&T Unlocked Grade B,$40.63,28.03
Samsung Galaxy S9 Fully Unlocked AT&T Verizon T-Mobile Sprint 64GB,$133.00,29.99
Samsung Galaxy A50 - SM-S506DL - 64GB - Black - (Tracfone) - Good,$59.99,27.83
Samsung Galaxy Xcover Pro SM-G715U1/ G715FN/DS Unlocked(Any Carrier)- New Sealed,$145.00 to $185.00,ree s
Samsung Galaxy S21 FE 5G SM-G990U T-Mobile Unlocked 128GB White Good,$199.99,32.73
Samsung Galaxy S23 FE 5G SM-S711B/DS 256GB 8GB Dual SIM Unlocked GSM Global,$569.99,42.88
"For Samsung S10  , Full Body 360 Ultra Slim Clear TPU Gel Cover Case",$7.58,12.66
Samsung Galaxy Z Flip 5 VERIZON  SM-F731U1,$520.00,41.40
Samsung Galaxy S21 Plus Glass Screen Protector Bubble-Free 2Pack Cover HD Clear,$16.99,26.56
Samsung Galaxy S10 G973U1 128GB - Factory Unlocked - Samsung CPO -,$289.00,34.59
Factory Unlocked Samsung Galaxy S21 5G 128GB Gray White Pink Violet - Very Good,$245.00 to $255.00,33.58
Samsung GT-S5690 Samsung Galaxy Xcover GT-S5690 - Orange/Black FUNCTION OK,$16.20,19.44
"Samsung Galaxy A20s Dual SIM 6.5"" 32GB/ 64GB Unlocked Smartphone-- New Unopened",$136.00 to $142.00,ree s
"NEW Samsung Galaxy A21s, 32GB, Unlocked, with box and accessories, All Colours",$163.27,26.04
Samsung Galaxy S10+ SM-G975U1 Factory Unlocked 128GB Prism Black C,$139.99,30.19
Gorilla Tempered Glass For Samsung Galaxy S23 Ultra S22 S20 FE Screen Protector,$5.05 to $10.11,12.66
"New ListingSamsung Galaxy S23 FE SM-S711U1 256GB 8GB RAM (FACTORY UNLOCKED) 6.4"" 50MP",$399.00,38.60
Samsung Galaxy Z Flip 5 SM-F731U1 Factory Unlocked 512GB Yellow OPEN BOX,$589.99,44.24
New ListingSamsung Galaxy A03s SM-A037U - 32GB - Black (Verizon) DEFECTIVE,$29.95,27.72
NEW SAMSUNG Galaxy XCover6 Pro SM-G736U 128GB - Black - (AT&T Locked) w Warranty,$400.00,
"For Samsung Galaxy Note 10+/10 Plus 5G Case,Shockproof Protective Glow Cover",$10.91,26.38
case For Samsung Galaxy S22 Ultra S23 S21 S20 FE Wallet Leather Flip Phone Cover,$8.85,12.66
NEW UNLOCKED Samsung Galaxy A71 5G SM-A716U. Any carrier WORLDWIDE. Warranty,$219.95,32.55
Samsung Galaxy S20 5G G981U - Choose Your Carrier - Great with Light Shadow -,$129.00,29.87
Samsung Galaxy S20 | S20+ | S20 FE | S20 Ultra 5G 128GB (Unlocked) - Good,$179.95 to $239.95,33.14
"Samsung Galaxy S21 5G 128GB 256GB All Colour Unlocked, Extra 15% OFF - VERY GOOD",$371.92,33.24
"Samsung Galaxy A14 A145P 128GB 4GB 6.6"" Factory Unlocked International",$144.94,31.11
Samsung Galaxy Z Flip5 256GB Gray Unlocked Very Good Condition,$599.99,43.76
Samsung Galaxy S10+ SM-G975U Verizon Unlocked 512GB Ceramic White C,$179.99,31.37
Samsung Galaxy Z Flip 4 SM-F721U1 Factory Unlocked 256GB Pink Gold Very Good,$294.99,35.54
Samsung Galaxy S6 Active SM-G890A - 32GB (ATT or GSM Unlocked) Gray Blue White,$74.99,21.02
Samsung Galaxy Z Fold 3 Spare Parts & Accessories Black/Silver,$14.99 to $29.99,19.69
Samsung Galaxy A71 UW 5G 128GB Prism Black T-Mobile Xfinity Verizon Unlocked,$129.99 to $149.99,23.23
For Samsung Galaxy Z Fold4 5G Shockproof Heavy Rugged Case Cover SM-F936 US,$11.39,26.40
New Samsung Galaxy S21+ PLUS 5G SM-G996U 128GB AT&T T-MOBILE VERIZON UNLOCKED,$317.99,36.21
NEW In Box Samsung Galaxy S9+ Plus G965U 64GB for AT&T & T-Mobile and Verizon,$189.99,32.44
"Samsung C3520 GSM 1.3 MP Camera 2.4"" Screen Original Unlocked Flip Mobile Phone",$39.00,ree s
Samsung Galaxy S22 Ultra All Colours & Storage (Unlocked) Smartphone A-Grade,$670.83,43.54
Samsung Galaxy S22 128GB 5G Unlocked Phantom Black - EXTRA 20% OFF - VERY GOOD,$476.35,36.83
Samsung Galaxy A03s SM-A037U (Black 32GB) Brand New In Box Carrier Lock,$80.00,37.79
Samsung Galaxy A52 5G SM-A526U - 128GB - Awesome Black (Unlocked) Good!,$174.95,23.96
Samsung Galaxy S10e G970U 128GB Factory Unlocked Android Smartphone,$108.00 to $118.00,29.25
360 Case for Samsung Galaxy S22 ULTRA A53 5G A13 S21 NOTE 20 CLEAR FULL COVER,$7.58,12.66
New ListingSamsung Galaxy A03s A037U1/DS 32GB Unlocked Fair Condition Check IMEI Lot of 3,$189.99,32.44
"Samsung Galaxy A20 SM-A205U 32GB ROM 3GB RAM 6.4"" Unlocked Smartphone-New Sealed",$107.00,ree s
Samsung Galaxy Note10 256GB SM-N970U1 Unlocked T-Mobile Verizon ☆NEW NO BOX☆,$256.48,42.62
Samsung Galaxy S22 Ultra Case Black Hybrid Scratchproof Anti Drop Slim Cover NEW,$32.99,27.81
Gorilla Glass For Samsung Galaxy S24 Ultra S23 S21 S20 S24+ Screen Protector,$5.05 to $10.11,12.66
Samsung Galaxy A50 128GB Unlocked 4G Android Smartphone Excellent Condition,$151.88,25.64
Samsung Galaxy S10 - 128-512GB - Verizon Prepaid ONLY - Very Good Condition,$119.99,29.60
Samsung Galaxy S21 5G G991U 128GB (Unlocked) White - Renewed,$199.00,31.93
3m Braided USB Type C FAST Charger Sync Cable Lead for Samsung S23 Ultra S22 S20,$8.85,12.66
Case For Samsung S23 S22 A21s A51 A71 S20FE A41 S10 S21 S8 Shockproof Hybrid,$5.05 to $7.58,20.67
"Samsung Galaxy A51 5G 128GB 6.5"" 6GB RAM Crush Blue (Factory Unlocked) - B Grade",$109.00,29.28
For Samsung Galaxy Z Flip3 Flip4 Flip5 Shockproof Protective Rugged Case Cover,$8.00 to $11.39,26.40
Case For Samsung Galaxy A54 S23 S22 S21 A53 A14 ShockProof FRONT + BACK Cover,$5.05 to $7.58,12.66
Samsung Galaxy Note10+ 5G - 256GB - Aura Glow (AT&T) (Single SIM),$375.00,47.87
Samsung Galaxy J4 Smart Phone 16GB Single SIM Android Unlocked - Black Grade B,$56.95,22.37
Samsung Galaxy A50 128GB Unlocked 4G Android Smartphone Excellent Condition,$151.88,25.64
Samsung Galaxy S10 - 128-512GB - Verizon Prepaid ONLY - Very Good Condition,$119.99,29.60
Samsung Galaxy Note10+ 5G - 256GB - Aura Glow (AT&T) (Single SIM),$375.00,47.87
Samsung Galaxy J4 Smart Phone 16GB Single SIM Android Unlocked - Black Grade B,$56.95,22.37
Samsung Galaxy S10 G973U GSM Unlocked 128GB Smartphone - Grade B+ Condition,$124.99,29.75
Samsung Galaxy S10 128GB G973U Verizon Locked with LCD Shadows - Very Good,$107.99,29.25
Samsung Galaxy S10e SM-G970U Factory Unlocked 128GB Prism Black Good Medium Burn,$94.99,28.86
Galaxy Note 20 Ultra White,$330.00,49.07
Samsung Galaxy Fold 5G - 512GB - Cosmos Black (Unlocked) Smartphone,$408.82,
Samsung Galaxy A14 SM-A145R/DSN - 64GB - Silver (Unlocked),$341.74,32.19
GLITTER STARS HEART Case For Samsung Galaxy A13 A33 A53 A52 A32 A22 Bling Cover,$3.78 to $5.05,20.58
Samsung Galaxy S10+ Plus SM-G975U 128GB Black GSM Unlocked AT&T T-Mobile Verizon,$204.99,32.11
Samsung Galaxy S20 FE SM-G781U 128GB 5G GSM Unlocked  - Grade B+,$154.99,30.63
Samsung Galaxy S21 | S21+ Plus 5G - 128GB - (Unlocked) Smartphone - Good,$234.95 to $294.95,27.50
Samsung Galaxy Z Flip3 5G SM-F711B - 128GB - Green,$86.42,
Open Box Samsung Galaxy S9 64GB GSM/CDMA Unlocked T-Mobile Verizon AT&T SM-G960U,$139.95,30.96
For Samsung Galaxy A52s A53 A54 5G Clear Shockproof 360 Full Body Silicone Case,$3.78 to $5.05,20.58
For Samsung Galaxy Z Flip5 Flip4 Flip3 5G Phone Case Heavy Duty Shockproof Cover,$9.99 to $11.39,19.14
"New ListingAssorted CDMA Phones Fair Condition Motorola, Samsung, LG Check IMEI Lot of 7",$112.99,29.40
Samsung Galaxy J7 Prime SM-J727T T-Mobile Unlocked 16GB Gold C,$39.99,27.24
stock phones Samsung & other brands Plus iPad 16 plus one for parts,$27.01,43.21
Samsung Galaxy S20 5G SM-G981U Unlocked 128GB Smartphone - Image Burn,$144.99,30.34
Samsung G973 Galaxy S10 128GB Factory Unlocked Smartphone Used,$143.00,30.28
Samsung Galaxy S21 Unlocked 5G SM-G991U 128GB LTE Smartphone,$208.00,32.20
Samsung Galaxy Note 10+ N975U GSM Factory Unlocked 256GB Smartphone - Grade B+,$229.99,32.85
Gorilla Tempered Glass For Samsung Galaxy S23 Ultra S22 S20 FE Screen Protector,$5.05 to $10.11,12.66
Factory Unlocked Samsung Galaxy S20 FE 5G 128GB 12GB RAM Navy Smartphone - Good,$169.00,31.82
Samsung Galaxy Z Flip 3 5G SM-F711U1 Factory Unlocked 256GB Lavender Good,$209.99,33.03
SMARTPHONE SAMSUNG GALAXY A32 4GB 128GB LIBRE,$156.63,14.03
Samsung Galaxy S6 Edge Global SM-G925F - 32GB - Gold  (Unlocked) Smartphone,$127.00,ree s
Samsung Galaxy S10e Unlocked Verizon T-Mobile AT&T G970U 128GB 256GB | Excellent,$99.00 to $129.99,28.98
Samsung Galaxy Note 20 5G SM-N981U1 Factory Unlocked 128GB Mystic Green C,$199.99,31.96
Samsung Galaxy S20 5G UW 128GB Verizon SM-G981V Great Condition with Shadows,$169.94,31.08
"Samsung Galaxy A20 32GB 6.4"" 3GB RAM Black (GSM Unlocked) Smartphone - Good",$95.00,29.64
Samsung Galaxy A10e SM-A102U US Cellular Unlocked 32GB Black C,$49.99,27.54
Samsung Galaxy A11 (UNLOCKED) SM-A115W - 64GB -   Unlocked,$99.99,29.78
Samsung Galaxy Z Flip 3 5G SM-F711U Factory Unlocked 256GB Phantom Black C,$169.99,31.08
For Samsung Galaxy A54 5G 100% Genuine Gorilla TEMPERED GLASS Screen Protector,$5.05,20.58
SAMSUNG SGH-F300 F300 ULTRA MUSIC Cell Phone,$172.83,27.01
Samsung Galaxy A14 5G SM-A146U 64GB Tmrvc3 Smartphone #17138R,$79.99,28.42
NEW Samsung Galaxy S9 / S9+ Plus 64GB 4G LTE Unlocked - re SEALED BOX Grade A+.,$164.16 to $189.47,
SAMSUNG GALAXY S23+ PLUS 5G S916U1 256GB│ 512GB (FACTORY UNLOCKED) ⚫️⚪️🟣❖O/B❖,$648.95 to $778.95,45.98
Samsung Galaxy A54 A546U1 5G 128GB Factory Unlocked- Any Carrier,$284.69,80.75
NEW Samsung Galaxy A54 5g 6GB RAM 128GB Unlocked,$269.00,34.77
Samsung Galaxy S22+ SM-S906U AT&T Unlocked 256GB Phantom Black Good,$359.99,37.45
SAMSUNG Galaxy S22 S901U 256GB US Carriers Unlocked Smartphone - Purple - NEW,$465.00,40.55
32GB Black Samsung Galaxy Note 4 Sprint Smartphone,$175.74,31.25
SAMSUNG GALAXY S20+ VERIZON 5G 128 GB USED WORKS,$175.00,39.22
"Samsung Galaxy A13 5G - 64GB (GSM UNLOCKED) Single Sim 6.5"" -Black Mint",$129.99,22.64
Samsung Galaxy Note 4 - SM-910V - Black (Unlocked) 4G LTE GSM Smartphone,$75.97,28.30
Samsung Galaxy On5 8GB Black SM-S550TL T-Mobile Brand New  (),$100.00,33.51
"Samsung Galaxy S9 64GB Unlocked Black, Blue, Purple, Grey Android 4G | Very Good",$179.74,26.61
Samsung Galaxy S7 & S7 edge 32GB - GSM Unlocked AT&T T-Mobile Verizon Cricket,$64.95 to $119.95,20.72
Samsung Galaxy Core Prime Black 8GB 4G LTE Sim Free Unlocked Android Smartphone,$70.49,22.83
OPEN BOX  Samsung Galaxy A13 - SM-A135U1 - 32GB - Black 4G LTE Factory Unlocked,$108.99,29.28
SAMSUNG GALAXY Z FLIP3 5G 128GB / 256GB SM-F711U (VERIZON ONLY) ⚫️⚪️🟣 ❖SEALED❖,$329.95,36.57
Samsung Galaxy A11 SM-A115U 32GB Fully Unlocked Smartphone - New in Box,$97.99,52.00
"Very Good! Samsung Galaxy S21+ 5G 6.7"" SM-G996U 128GB Factory Unlocked - Violet",$299.00,34.88
For Samsung  A12 A13 14 A34 33 A22 A54 Bling Glitter Sparkly Soft Gel Phone Case,$6.06 to $7.53,20.67
NEW Samsung Galaxy S10+ Plus G975U1 128GB Factory Unlocked GSM+CDMA All Carriers,$264.88,33.88
For Samsung Galaxy S22 S23 S24 Ultra Shockproof Case Cover & Screen Protector,$13.96,26.47
Samsung Galaxy A03s SM-A037U 32GB Unlocked (Single SIM) Black (Excellent),$77.99,29.13
"ORIGINAL BOXED SPARE SIMPLE SAMSUNG U600 ON ORANGE, TALKHOME,CO-OP, NOW MOBILE",$48.10,17.72
Samsung Xplorer B2100 Black/Grey (Without Simlock) Dust - Waterproof!! like new!,$158.70,48.61
Samsung Galaxy S10e SM-G970U 128GB+6GB Factory Unlocked Smartphone -New Unopened,$189.00,ree s
Samsung Galaxy S8 Plus - 64 GB - Unlocked SIM - Black - Working - Fair! Read!,$92.50,28.79
"LOT OF 10 Samsung Galaxy S3 Blue/Black GSM Unlocked , International as well",$199.95,55.01
"Samsung Galaxy A71 5G - 128GB - Black T-Mobile/AT&T/Verizon Or Unlocked, Good",$96.53 to $140.25,29.46
Samsung Galaxy S7 SM-G930 32GB Black Unlocked Average Condition Grade C 522,$58.21,37.96
Samsung Galaxy Xcover Pro with Otterbox Case- 64GB - Black(Verizon),$99.99,29.01
Samsung Galaxy A12 SM-A125U - 64GB/4GB - Black (Unlocked) (Single SIM),$129.99,29.90
Samsung Galaxy Z Flip5 SM-F731B - 256GB - 512GB (Unlocked) ALL COLOURS Excellent,$696.15,44.42
Gorilla Tempered Glass For Samsung Galaxy S24 Ultra S24+ S23  Screen Protector,$5.05 to $10.11,12.66
Samsung Galaxy Z Flip SM-F700U AT&T Unlocked 256GB Mirror Black Good,$199.99,32.73
GLITTER STARS CASE For Samsung S20 FE A21s BLING Shockproof Silicone Soft Cover,$5.00,20.58
9D Gorilla Glass For Samsung Galaxy S23 S22 S20 S21 Tempered Screen Protector,$7.58 to $10.11,12.66
Factory Unlocked Samsung Galaxy A42 5G (SM-A426U) 128GB Black Gray - Open Box,$169.00,31.05
Samsung Galaxy S10e SM-G970U 128GB Black Unlocked Smartphone- Good,$114.75,29.45
"Used - Samsung Galaxy A14 A145P 128GB 4GB 6.6"" Unlocked",$105.00,29.16
For Samsung Galaxy Z Flip3 Flip4 Flip5 Shockproof Heavy Duty Case Cover & Ring,$7.97 to $11.39,19.14
Unlocked 3.0'' SAMSUNG GALAXY YOUNG S6310 Original 3G Wifi 3MP 4GB Android Smart,$60.15,ree s
Samsung Galaxy Z Fold 3 5G SM-F926U Factory Unlocked 256GB Phantom Black C,$359.99,37.45
Samsung Galaxy Z Flip 3 5G 256GB(SM-F711U1) Black - Unlocked - See Description!!,$204.95,32.11
Samsung Galaxy S22+ - 256 GB - Phantom White (Unlocked) - PERFECT Condition,$399.00,37.83
Samsung Galaxy S20 FE SM-G781U 128GB 5G T-Mobile GSM Unlocked - Very Good,$171.99,31.14
Samsung Galaxy S21 5G 64GB 128GB 256GB Verizon AT&T T-Mobile Unlocked (Good),$190.94 to $498.74,31.95
Samsung Galaxy A12 SM-A125U AT&T Locked 32GB Black Slightly Used Good Condition,$120.99,30.40
⭐Samsung Galaxy A03s⭐32GB Black Unlocked AT&T T-Mobile TracFone - Open Box,$75.00 to $85.00,28.57
For Samsung Galaxy S10 Genuine Tempered Glass Screen Protector Case Friendly,$8.85,12.66
"Samsung Galaxy S22 5G 128GB | 256GB FACTORY UNLOCKED 6.1"" Smartphone - EXCELLENT",$348.00,36.33
Samsung Galaxy A04e Android Unlocked GSM Dual SIM LTE  64GB /3GB Cell Phone BL,$107.97,29.25
Samsung Galaxy S20 5G SM-G981V Factory Unlocked 128GB Cosmic Gray C,$159.99,30.78
Samsung Galaxy S7 - G930T - 32GB - Black (T-Mobile) Smartphone,$59.90,27.83
SAMSUNG GALAXY A23 5G SM-A236U 64GB Black AT&T/T-Mobile GSM Unlocked - VERY GOOD,$129.00,30.64
UNLOCKED / T-Mobile Metro Samsung Galaxy A12 A125U LTE 32GB Smart Phone *B GRADE,$76.40 to $77.40,38.27
Samsung Galaxy S10 128GB Unlocked Prism White - £10 EXTRA OFF - VERY GOOD - A,$253.14,29.14
UNLOCKED / T-Mobile Metro Samsung Galaxy A12 A125U LTE 32GB Smart Phone *B GRADE,$76.40 to $77.40,38.27
Samsung Galaxy A51 5G 128GB - SM-A516U (Unlocked Simple MetroPCS T-Mobile AT&T),$119.99 to $139.99,22.64
Samsung Galaxy S10 128GB Unlocked Prism White - £10 EXTRA OFF - VERY GOOD - A,$253.14,29.14
"Straight Talk Prepaid Samsung Galaxy A03s 32GB Phone 6.5"" HD, Locked to Prepaid",$71.99,28.96
Samsung Galaxy Z Fold 3 5G SM-F926U Factory Unlocked 256GB Phantom Black C,$359.99,37.45
Samsung Galaxy Z Flip 3 5G 256GB(SM-F711U1) Black - Unlocked - See Description!!,$204.95,32.11
Samsung Galaxy S22+ - 256 GB - Phantom White (Unlocked) - PERFECT Condition,$399.00,37.83
Samsung Galaxy S20 FE SM-G781U 128GB 5G T-Mobile GSM Unlocked - Very Good,$171.99,31.14
Samsung Galaxy S21 5G 64GB 128GB 256GB Verizon AT&T T-Mobile Unlocked (Good),$190.94 to $498.74,31.95
Samsung Galaxy A15 128GB Dual Sim 4GB RAM 4G Unlocked Android Smartphone Sealed,$239.21,28.66
For Samsung Galaxy S10 Genuine Tempered Glass Screen Protector Case Friendly,$8.85,12.66
"Samsung Galaxy S22 5G 128GB | 256GB FACTORY UNLOCKED 6.1"" Smartphone - EXCELLENT",$348.00,36.33
Samsung Galaxy A04e Android Unlocked GSM Dual SIM LTE  64GB /3GB Cell Phone BL,$107.97,29.25
9D Gorilla Glass For Samsung Galaxy S23 S22 S20 FE Screen Protector Tempered,$5.05 to $10.11,12.66
Samsung Duos GT-B5722 - Dark Brown,$147.90,48.61
Samsung Galaxy A40 64GB - All Colours - Dual SIM - Network Unlocked - Good,$88.54,23.45
Samsung Galaxy S20 5G SM-G981V Factory Unlocked 128GB Cosmic Gray C,$159.99,30.78
Samsung Galaxy S7 - G930T - 32GB - Black (T-Mobile) Smartphone,$59.90,27.83
SAMSUNG GALAXY A23 5G SM-A236U 64GB Black AT&T/T-Mobile GSM Unlocked - VERY GOOD,$129.00,30.64
For Samsung Galaxy S22 S23 S24 Ultra Tempered Glass Screen Protector Camera Lens,$11.39 to $14.24,26.40
Samsung Galaxy A71 SM-A715W 128GB Black Unlocked Android Fair,$158.10,30.73
New ListingSamsung Galaxy S21 FE 128GB (Verizon) SM-G990U2 Graphite - Vibration,$154.95,31.41
Samsung Galaxy S6 Edge 32GB Unlocked  4G  Android Smartphone Very Good Condition,$101.25,23.90
Samsung Flip Phone E1272 Dual Sim Black White Red Big Button Basic Folding Phone,$36.06,32.91
Samsung Galaxy J5 J530F (2017) - 16/32GB Unlocked All Colours Good Condition,$63.27,27.83
"Black Samsung GALAXY Trend Plus GT-S7580 4"" Unlocked Android 3G 4GB",$28.93,ree s
Samsung Galaxy S5 SM-G900F - 16GB - Shimmery White (Unlocked) Smartphone,$50.00,33.38
Samsung Galaxy Z Flip4 128GB F721U Unlocked with LCD Shadows - Excellent,$281.99,34.38
Samsung Galaxy A10e (SM-S102DL)32GB TRACFONE(AMERICAMOVIL) Smartphone Blue FAIR,$55.25,27.69
Samsung Galaxy S21 | S21+ Plus 5G - 128GB - (Unlocked) Smartphone - Very Good,$254.95 to $314.95,26.32
Samsung Smiley SGH-T359 Black Blue T-Mobile Cellular Slider Phone 3G GSM,$29.95,26.95
Case For Samsung S7 & S7 EDGE Luxury Leather Flip 2 in 1 Detachable Wallet Cover,$8.85,20.71
Samsung Galaxy J3 V SM-J337V Verizon Unlocked 16GB Black Good,$39.99,27.24
Samsung Galaxy Note 8 SM-N950U - 64GB -  Black (AT&T) GSM Phone,$169.99,31.85
"Samsung Galaxy S20 Ultra 5G SM-G988U Unlocked 128GB 6.9"" Large Screen Used",$229.98,33.62
Samsung Galaxy Z Fold4 256GB 512GB All Color Unlocked *UK Stock Box Pack Grade A,$854.38,49.88
Samsung Galaxy A51 A515U Factory Unlocked 128GB Black C Light Burn,$80.00,29.19
Samsung Galaxy A23 5G - 64GB - Black (Boost Mobile) (Single SIM) Free Ship!,$139.99,30.96
Samsung Galaxy S5 Active | SM-G870A | 16GB | Charcoal Gray | AT&T Unlocked,$111.24,29.34
Samsung Galaxy Note 5 Gold  Network Unlocked 4gb RAM 32gb ROM,$149.99,30.49
Samsung Galaxy S8 SM-G950U Factory Unlocked 64GB Midnight Black C,$79.99,28.42
Samsung Galaxy S9+ S9 Plus 64GB Unlocked SM-G965U1 S9+ Excellent,$145.95,30.37
For Samsung Galaxy Z Flip 3/Flip 4/Flip 5 5G Shockproof Heavy Duty Case Cover,$11.96,26.41
Samsung - Galaxy A54 5G 128GB (T-Mobile) - Awesome Graphite Excellent,$239.99,33.14
"In Stock NEW Factory Unlocked Samsung S24 256 GB 6.2"" FHD Marble Grey US + Bonus",$849.95,61.09
95% N ew Unlocked Original Samsung GT-E1150 2G GSM  Button Flip Mobile Phone,$30.00,ree s
Original Samsung Galaxy Note 4 SM-N910A 32GB Black Unlocked Smartphone Very Good,$66.22,28.02
"*AS-IS* Samsung Galaxy S10 SM-G973U, 128GB, Prism Black (AT&T) (32211-1)",$160.99,31.58
Samsung SGH-S300 Worldwide Olympic Cellphone Vintage International White - NEW,$18.74,34.66
Samsung Galaxy - S10 G973U - S10e G970U - S10+ Plus G975U - ALL COLORS! Unlocked,$204.00,32.85
Samsung Galaxy A51 5G 128GB - SM-A516U (Unlocked Simple MetroPCS T-Mobile AT&T),$119.99 to $139.99,22.64
Samsung Galaxy Core Prime SM-G360P - 8GB - Gray (Unlocked) Smartphone Tracfone,$179.00,32.11
Fully UNLOCKED Samsung Galaxy Note 20 Ultra 5G N986U 128GB OPEN BOX,$419.95,39.22
For Samsung Galaxy Z Flip3 Flip4 Flip5 Shockproof Heavy Duty Case Cover & Ring,$7.97 to $11.39,19.14
"Samsung Galaxy S4 zoom C1010 SM-C101 HSDPA 4.3"" Android WI-FI 16MP Camera Phone",$117.51,ree s
Samsung Galaxy S21 Plus 5G 128GB Violet - Unlocked Nice CONDITION,$327.83,21.52
Samsung Galaxy Z Flip 4 SM-F721U1 Factory Unlocked 512GB Graphite Very Good,$349.99,37.16
Samsung Galaxy S7 32GB SM-G930F Unlocked Android Smartphone Very Good Condition,$107.58,30.68
For Samsung Galaxy S23 ULTRA S22 S21 S20 Tempered Glass Gorilla Screen Protector,$7.58 to $8.85,12.66
Samsung Galaxy S22 5G 128GB | 256GB FACTORY UNLOCKED Smartphone - GOOD,$308.00 to $346.00,35.15
Samsung Galaxy S21 Ultra 5G SM-G998U Factory Unlocked 128GB Phantom Silver C,$299.99,34.91
Samsung Galaxy A53 5G UW A536V 128GB Black Verizon Clean IMEI,$199.99,31.96
Samsung Galaxy A14 SM-A145R/DSN - 64GB - Silver (Unlocked),$341.74,32.19
Brand New Samsung Galaxy Note III SM-N9005 - 32GB Black (Unlocked) Smartphone,$277.20,29.97
Samsung Galaxy A01 SM-S111DL GSM Unlocked (AT&T/T-mobile) 16GB SmartPhone,$49.00,27.51
Samsung Galaxy A51 SM-A515U 128GB+4GB 48MP Unlocked Smartphone-New Unopened,$153.00,ree s
Samsung Galaxy Note 10 Plus 5G 12RAM 256GB SM-N976B (Unlocked) Aura Glow,$480.99,18.99
Samsung Galaxy S22 5G S901U (Verizon) Locked - Excellent,$319.99,35.50
Samsung Galaxy S9+ SM-G965 - 64GB - Lilac Purple (AT&T) Smartphone,$125.00,39.75
NEW Samsung Galaxy S21 Plus 5G 256GB Unlocked -re SEALED BOX - Pristine A+.,$379.33 to $417.31,
Samsung Galaxy A25 5G Factory Unlocked Dual SIM GSM 256GB Rom 8GB Ram Yellow,$320.00,45.27
New ListingT-Mobile Samsung Galaxy Note 10+ Plus 5G N976U Smart Phone - LYCA Tello SIMPLE,$149.00,40.41
"Samsung Galaxy S10 Plus SM-G975U , 1TB , Ceramic Black,Unlocked,Good Cond:CC132",$225.00,48.42
Samsung Galaxy Z Flip4 128GB Graphite Unlocked Good Condition,$319.99,35.50
"For Samsung Galaxy S23 FE 6.4"" MagSafe Magnetic Case Slim Cover SM-S711",$11.39,26.40
Samsung Galaxy A03S- 32GB/Black (FACTORY UNLOCKED) GSM/GRADE A,$124.49,36.60
Samsung Galaxy Note 4 Sprint 32GB White Used,$49.99,38.30
"Samsung Galaxy Golden GT-I9235 3.7"" 4G LTE 8MP Camera 16GB ROM Flip Cellphone",$98.72,12.66
New! Samsung Galaxy Core Prime - 8GB - White Metro SM-360T1,$44.99,34.25
Samsung Galaxy A51 128GB A515U Unlocked with LCD Shadows - Very Good,$105.99,29.19
Samsung Galaxy Note 20 5G SM-N981U Verizon Unlocked 128GB Mystic Gray Good,$219.99,32.55
Samsung Galaxy Z Flip 4 SM-F721W Factory Unlocked 256GB Bora Purple Excellent,$329.99,35.80
C3050 Original Samsung C3050 2.0 Inches GPRS GSM Cheap Mini-SIM Cellphone Unlock,$42.00,ree s
Samsung Galaxy A01 2019 SM-A015V Verizon Unlocked 16GB Black Good,$49.99,27.54
Clear Case Cover For Samsung Galaxy S22 S20 FE A13 A53 A22 A33 A52 A32 A21s A12,$2.52 to $5.05,20.58
"Samsung Galaxy S10 SM-G973U 128GB Smartphone Prism Black, SM-G973U ZAXAA",$200.00,31.96
Samsung Galaxy A71 SM-A715W 128GB Black Unlocked Android Fair,$158.10,30.73
Samsung Galaxy A10e SM-A102U1 Factory Unlocked (GSM + CDMA) 32GB Smartphone,$63.15,28.70
"Used - Samsung Galaxy A23 A235F 128GB 4GB 6.6"" Unlocked",$110.00,29.31
Samsung Galaxy Note20 5G N981U 128GB Unlocked with LCD Shadows - Very Good,$219.99,32.55
Samsung Galaxy Z Flip 5 VERIZON  SM-F731U1,$520.00,41.40
Samsung Galaxy Z Fold3 5G SM-F926B/DS 256/512GB Unlocked Good Condition,$531.60,27.83
New ListingSAMSUNG GALAXY A13 PERFECT SMARTPHONE,$140.43,32.41
Samsung Galaxy Xcover 5 SM-G525F/DS Dual SIM 64GB Unlocked Smartphone-New Sealed,$159.72,ree s
Samsung Mobile Phone Keystone 2 GT-E1200I Black! New & original packaging! Without Simlock!,$42.12,10.69
Samsung Galaxy A13 5G- 64GB/Black (FACTORY UNLOCKED) GSM/GRADE A,$149.00,36.55
New&Sealed Samsung Galaxy S8 64GB UNLOCKED SM-G950U(USA)/G950F(Global) Android,$180.00 to $200.00,ree s
Samsung Galaxy A51 SM-A515U 128GB Black (Unlocked) W/Retail Box - Very Good,$159.00,30.75
Samsung Galaxy S6 Edge Global SM-G925F - 32GB - White (Unlocked) Smartphone,$127.00,ree s
95% N ew Unlocked Original Samsung GT-E1150 2G GSM  Button Flip Mobile Phone,$30.00,ree s
Samsung Galaxy A30 SM-A305G Unlocked 32GB Black Very Good,$79.99,28.42
"Used - Samsung Galaxy A14 128GB 4GB 6.6"" Unlocked A145M",$110.00 to $115.00,29.31
"Open Box Samsung Galaxy A34 5G A346M 256GB 8GB 6.6"" UNLOCKED",$230.00,33.62
Samsung Galaxy S21 FE 5G SM-G990U 128GB Unlocked Smartphone - Grade B+,$204.99,32.11
Samsung SM-G900V Galaxy S5 Verizon Smartphone IMEI:  990004471595458,$39.95,28.01
SAMSUNG GALAXY Z FLIP4 5G SM-F721U1 256GB BLUE (FACTORY UNLOCKED) ❖O/B❖,$398.94,37.83
Samsung Galaxy Note 4 (SM-N910V) - 32 GB - Verizon - Black - TESTED & WORKING,$44.99,34.38
Samsung Galaxy Note 20 Ultra 5G SM-N986U Verizon Unlocked 128GB Mystic Black C,$299.99,34.91
"Samsung Galaxy A03s 32GB Black (AT&T) Prepaid Smartphone 6.5"" HD Display - Black",$79.99,28.42
Samsung Galaxy S22 Ultra 256GB 5G Unlocked Black - EXTRA 15% OFF - VERY GOOD A,$759.44,46.60
Samsung Galaxy A12 32GB Black Prepay Total Wireless New in Box Smartphone,$89.47,34.93
Family Mobile Samsung Galaxy On5 T-mobile Walmart 8Gb Storage,$32.00,36.63
Gorilla Glass For Samsung Galaxy Note20 Ultra S22 S21 S20 S23 Screen Protector,$5.05 to $10.11,12.66
Samsung Galaxy A01 2019 SM-A015V Verizon Unlocked 16GB Black Good,$49.99,27.54
Case for Samsung Galaxy S20 FE S21 S22 S10+ 360 Shockproof Protective TPU Cover,$7.58,12.66
Samsung S20 FE - 128GB - Blue - Model SM-6780G/DS,$220.00,33.32
Samsung Galaxy Y GT-S5360 Smartphone,$10.79,23.12
